<?xml version="1.0" encoding="UTF-8"?>

<xs:schema xmlns:xs="http://www.w3.org/2001/XMLSchema" elementFormDefault="qualified">
    <xs:element name="gyorki_orarend">
        <xs:complexType>
            <xs:sequence>
                <xs:element name="ora" minOccurs="1" maxOccurs="unbounded">
                    <xs:complexType>
                        <xs:sequence>
                            <xs:element name="targy" type="xs:string"/>
                            <xs:element name="idopont">
                                <xs:complexType>
                                    <xs:sequence>
                                        <xs:element name="nap" type="xs:string" minOccurs="1" maxOccurs="1"/>
                                        <xs:element name="tol" type="xs:string" minOccurs="1" maxOccurs="1"/>
                                        <xs:element name="ig" type="xs:string" minOccurs="1" maxOccurs="1"/>
                                    </xs:sequence>
                                </xs:complexType>
                            </xs:element>
                            <xs:element name="helyszin" type="xs:string"/>
                            <xs:element name="oktato" type="xs:string"/>
                            <xs:element name="szak" type="xs:string"/>
                        </xs:sequence>
                        <xs:attribute name="id" type="xs:int"/>
                        <xs:attribute name="tipus" type="xs:string"/>
                    </xs:complexType>
                </xs:element>
            </xs:sequence>
        </xs:complexType>
    </xs:element>
</xs:schema>